{
  "id": "backCover",
  "version": 1,
  "builderModule": "generator/builders/back-cover-slide.js",
  "builderExport": "addBackCover",
  "geometryKinds": {
    "logoBox": "box",
    "headingBox": "box",
    "disclaimerBox": "box",
    "urlBox": "box"
  },
  "requiredGeometry": [
    "logoBox",
    "headingBox",
    "disclaimerBox",
    "urlBox"
  ],
  "optionalGeometry": [],
  "optionalDefaults": {},
  "paginationPolicyKey": "none.v1",
  "master": "KPMG_CLOSING",
  "slotSchemaRef": "backCover",
  "validationHooks": [],
  "excludeFromLogicalPaging": true
}
